{
  "standard": "NIST SP 800-171 Rev 2",
  "title": "Protecting Controlled Unclassified Information in Nonfederal Systems and Organizations",
  "url": "https://csrc.nist.gov/pubs/sp/800/171/r2/final",
  "source": {
    "path": "sources/nist/NIST.SP.800-171r2.pdf",
    "sha256": "298bdbfcf6a4890a564b225c893230a0b32b2e69e3b98dd898aaeb1d544c5e12",
    "generated_at": "2026-02-19",
    "notes": "Hand-extracted starter sample (11 of 110 requirements). NIST does not publish an OSCAL JSON for 800-171 Rev 2 — only Rev 3 — so this catalog cannot be regenerated automatically. Use controls/nist-800-171/rev3/catalog.json for full machine-derived coverage on the newer revision."
  },
  "controls": {
    "3.4.1": {
      "family": "Configuration Management",
      "title": "System Component Inventory",
      "description": "Establish and maintain baseline configurations and inventories of organizational systems.",
      "derived_from": ["CM-8"]
    },
    "3.4.2": {
      "family": "Configuration Management",
      "title": "Security Configuration Enforcement",
      "description": "Establish and enforce security configuration settings for information technology products.",
      "derived_from": ["CM-6"]
    },
    "3.5.10": {
      "family": "Identification and Authentication",
      "title": "Cryptographic Authentication",
      "description": "Store and transmit only cryptographically-protected passwords.",
      "derived_from": ["IA-5(1)"]
    },
    "3.8.9": {
      "family": "Media Protection",
      "title": "Media Sanitization",
      "description": "Sanitize or destroy system media containing CUI before disposal or release for reuse.",
      "derived_from": ["MP-6"]
    },
    "3.11.2": {
      "family": "Risk Assessment",
      "title": "Vulnerability Scanning",
      "description": "Scan for vulnerabilities in organizational systems and applications periodically and when new vulnerabilities are identified.",
      "derived_from": ["RA-5"]
    },
    "3.11.3": {
      "family": "Risk Assessment",
      "title": "Vulnerability Remediation",
      "description": "Remediate vulnerabilities in accordance with risk assessments.",
      "derived_from": ["RA-5"]
    },
    "3.13.16": {
      "family": "System and Communications Protection",
      "title": "CUI at Rest",
      "description": "Protect the confidentiality of CUI at rest.",
      "derived_from": ["SC-28"]
    },
    "3.14.1": {
      "family": "System and Information Integrity",
      "title": "Flaw Remediation",
      "description": "Identify, report, and correct system flaws in a timely manner.",
      "derived_from": ["SI-2"]
    },
    "3.14.2": {
      "family": "System and Information Integrity",
      "title": "Malicious Code Protection",
      "description": "Provide protection from malicious code at designated locations within organizational systems.",
      "derived_from": ["SI-3"]
    },
    "3.14.3": {
      "family": "System and Information Integrity",
      "title": "Security Alerts and Advisories",
      "description": "Monitor system security alerts and advisories and take action in response.",
      "derived_from": ["SI-5"]
    },
    "3.14.6": {
      "family": "System and Information Integrity",
      "title": "System Monitoring",
      "description": "Monitor organizational systems, including inbound and outbound communications traffic.",
      "derived_from": ["SI-4"]
    }
  }
}
